ended_at,kind,meta,meta.asked_more_time,meta.complete_order,meta.coupon_used,meta.mobile_order,meta.out_of_stock_items,meta.s3_key,meta.segment_index,meta.step1_raw,meta.text,meta.total_segments_in_video,meta.video_end_seconds,meta.video_start_seconds,run_id,started_at,tx_range,video_id
2025-08-30T17:36:16Z,order,,0,1,0,0,0,gdrive/dq_cary/DT_File20250830170001000.mp4,1,"{""1"": ""Operator: Welcome to Dairy Queen, how may I help you?\nCustomer: Hey, can I have a medium M&M blizzard?\nOperator: Anything else for you?\nCustomer: Um, I do make chocolate ice cream, right?\nOperator: I can make you a chocolate ice cream.\nCustomer: Yes, please. And then can I have a small bean?\nOperator: Okay.\nCustomer: And then I'll have a medium caramel toffee cookie.\nOperator: Anything else for you?\nCustomer: That's it.\nOperator: It'll be $17.50.\nCustomer: Thank you.\nOperator: You're welcome."", ""2"": ""1"", ""3"": ""0"", ""4"": ""0"", ""5"": ""0"", ""6"": ""0"", ""7"": ""N/A""}","Operator: Welcome to Dairy Queen, how may I help you?
Customer: Hey, can I have a medium M&M blizzard?
Operator: Anything else for you?
Customer: Um, I do make chocolate ice cream, right?
Operator: I can make you a chocolate ice cream.
Customer: Yes, please. And then can I have a small bean?
Operator: Okay.
Customer: And then I'll have a medium caramel toffee cookie.
Operator: Anything else for you?
Customer: That's it.
Operator: It'll be $17.50.
Customer: Thank you.
Operator: You're welcome.",3,2175.0,2130.0,42a7212b-5c74-4e94-b42c-f2479402b71f,2025-08-30T17:35:31Z,"[""2025-08-30T17:35:31Z"",""2025-08-30T17:36:16Z"")",e42664af-2e03-4148-82b4-e0a00172fdfd
2025-08-30T17:37:01Z,order,,0,0,0,0,0,gdrive/dq_cary/DT_File20250830170001000.mp4,2,"{""1"": ""Operator: Welcome to Dairy Queen, how may I help you?\nCustomer: Can you just give me one, two seconds?\nOperator: Alright.\nCustomer: I'm looking, my heart.\nOperator: You know what you're getting?\nCustomer: Of course.\nOperator: Here you go."", ""2"": ""0"", ""3"": ""0"", ""4"": ""0"", ""5"": ""0"", ""6"": ""0"", ""7"": ""N/A""}","Operator: Welcome to Dairy Queen, how may I help you?
Customer: Can you just give me one, two seconds?
Operator: Alright.
Customer: I'm looking, my heart.
Operator: You know what you're getting?
Customer: Of course.
Operator: Here you go.",3,2220.0,2175.0,42a7212b-5c74-4e94-b42c-f2479402b71f,2025-08-30T17:36:16Z,"[""2025-08-30T17:36:16Z"",""2025-08-30T17:37:01Z"")",e42664af-2e03-4148-82b4-e0a00172fdfd
2025-08-30T17:38:31Z,order,,0,1,0,0,0,gdrive/dq_cary/DT_File20250830170001000.mp4,0,"{""1"": ""Customer: Yeah, can I get a mini peanut bar blizzard?\nOperator: All right.\nOperator: Anything else?\nCustomer: Can I get the same thing for Oreo?\nOperator: Is that the mini size as well?\nCustomer: Yes, ma'am.\nOperator: Okay.\nOperator: Anything else?\nCustomer: Can I do a regular fry?\nCustomer: An order of the pretzel sticks.\nOperator: Okay.\nCustomer: That's it.\nOperator: All right, it'll be $14.48.\nCustomer: Thank you.\nOperator: You're welcome."", ""2"": ""1"", ""3"": ""0"", ""4"": ""0"", ""5"": ""0"", ""6"": ""0"", ""7"": ""'All right, it'll be $14.48.' shows completion; no words such as 'mobile', 'coupon', 'one moment', or 'out of stock' appear, so the respective values are all 0.""}","Customer: Yeah, can I get a mini peanut bar blizzard?
Operator: All right.
Operator: Anything else?
Customer: Can I get the same thing for Oreo?
Operator: Is that the mini size as well?
Customer: Yes, ma'am.
Operator: Okay.
Operator: Anything else?
Customer: Can I do a regular fry?
Customer: An order of the pretzel sticks.
Operator: Okay.
Customer: That's it.
Operator: All right, it'll be $14.48.
Customer: Thank you.
Operator: You're welcome.",4,2310.0,2235.0,42a7212b-5c74-4e94-b42c-f2479402b71f,2025-08-30T17:37:16Z,"[""2025-08-30T17:37:16Z"",""2025-08-30T17:38:31Z"")",e42664af-2e03-4148-82b4-e0a00172fdfd
2025-08-30T17:39:46Z,order,,0,1,0,0,0,gdrive/dq_cary/DT_File20250830170001000.mp4,1,"{""1"": ""Operator: Welcome to Dairy Queen. How may I help you?\nCustomer: Can I get a regular fry and a regular cheeseburger?\nOperator: Would you like ranch or marinara?\nCustomer: Neither.\nOperator: Anything else?\nCustomer: That's it.\nOperator: It'll be $8.21.\nCustomer: Actually, do you have a few Coke products? Do you have Mellow Yellow?\nOperator: We do.\nCustomer: Can I get a medium Mellow Yellow?\nOperator: Yeah.\nCustomer: Thank you."", ""2"": ""1"", ""3"": ""0"", ""4"": ""0"", ""5"": ""0"", ""6"": ""0"", ""7"": ""'It'll be $8.21.' signals a completed order; no mention of mobile orders, coupons, wait requests, or out-of-stock items, so those fields are 0.""}","Operator: Welcome to Dairy Queen. How may I help you?
Customer: Can I get a regular fry and a regular cheeseburger?
Operator: Would you like ranch or marinara?
Customer: Neither.
Operator: Anything else?
Customer: That's it.
Operator: It'll be $8.21.
Customer: Actually, do you have a few Coke products? Do you have Mellow Yellow?
Operator: We do.
Customer: Can I get a medium Mellow Yellow?
Operator: Yeah.
Customer: Thank you.",4,2385.0,2310.0,42a7212b-5c74-4e94-b42c-f2479402b71f,2025-08-30T17:38:31Z,"[""2025-08-30T17:38:31Z"",""2025-08-30T17:39:46Z"")",e42664af-2e03-4148-82b4-e0a00172fdfd
2025-08-30T17:41:01Z,order,,0,1,0,0,0,gdrive/dq_cary/DT_File20250830170001000.mp4,2,"{""1"": ""Operator: Welcome to Dairy Queen. How may I help you?\nCustomer: Can I get a small sundae with pineapple topping?\nOperator: Okay.\nCustomer: And let me get another sundae with strawberry topping.\nOperator: So one small with pineapple and one with strawberry?\nCustomer: Uh-huh, small as well.\nOperator: All right.\nCustomer: And that's all.\nOperator: It'll be $5.41."", ""2"": ""1"", ""3"": ""0"", ""4"": ""0"", ""5"": ""0"", ""6"": ""0"", ""7"": ""'It'll be $5.41.' confirms completion; no mobile order, coupon, wait instruction, or out-of-stock reference appears, so those are 0.""}","Operator: Welcome to Dairy Queen. How may I help you?
Customer: Can I get a small sundae with pineapple topping?
Operator: Okay.
Customer: And let me get another sundae with strawberry topping.
Operator: So one small with pineapple and one with strawberry?
Customer: Uh-huh, small as well.
Operator: All right.
Customer: And that's all.
Operator: It'll be $5.41.",4,2460.0,2385.0,42a7212b-5c74-4e94-b42c-f2479402b71f,2025-08-30T17:39:46Z,"[""2025-08-30T17:39:46Z"",""2025-08-30T17:41:01Z"")",e42664af-2e03-4148-82b4-e0a00172fdfd
2025-08-30T17:42:16Z,order,,0,1,0,0,0,gdrive/dq_cary/DT_File20250830170001000.mp4,3,"{""1"": ""Operator: Welcome to Dairy Queen. How may I help you?\nCustomer: Hello. Can I get the two-piece chicken strip kids meal?\nOperator: All right. What's the drink?\nCustomer: Can I do a Sprite, please?\nOperator: All right. What was the dipping sauce for that?\nCustomer: Can I do ranch?\nOperator: And with the kids, ice cream in a cone or in a cup?\nCustomer: Can I put it in a cup, please?\nCustomer: And can I add a strawberry to it?\nOperator: Okay.\nCustomer: And that's it.\nOperator: It'll be $6.91.\nCustomer: Thank you.\nOperator: You're welcome."", ""2"": ""1"", ""3"": ""0"", ""4"": ""0"", ""5"": ""0"", ""6"": ""0"", ""7"": ""'It'll be $6.91.' provides the total, indicating completion; there are no statements about mobile orders, coupons, wait times, or out-of-stock items, so each of those values is 0.""}","Operator: Welcome to Dairy Queen. How may I help you?
Customer: Hello. Can I get the two-piece chicken strip kids meal?
Operator: All right. What's the drink?
Customer: Can I do a Sprite, please?
Operator: All right. What was the dipping sauce for that?
Customer: Can I do ranch?
Operator: And with the kids, ice cream in a cone or in a cup?
Customer: Can I put it in a cup, please?
Customer: And can I add a strawberry to it?
Operator: Okay.
Customer: And that's it.
Operator: It'll be $6.91.
Customer: Thank you.
Operator: You're welcome.",4,2535.0,2460.0,42a7212b-5c74-4e94-b42c-f2479402b71f,2025-08-30T17:41:01Z,"[""2025-08-30T17:41:01Z"",""2025-08-30T17:42:16Z"")",e42664af-2e03-4148-82b4-e0a00172fdfd
2025-08-30T17:44:01Z,order,,0,0,0,0,0,gdrive/dq_cary/DT_File20250830170001000.mp4,0,"{""1"": ""Operator: Welcome to Dairy Queen, how may I help you?"", ""2"": ""0"", ""3"": ""0"", ""4"": ""0"", ""5"": ""0"", ""6"": ""0"", ""7"": ""N/A""}","Operator: Welcome to Dairy Queen, how may I help you?",1,2640.0,2610.0,42a7212b-5c74-4e94-b42c-f2479402b71f,2025-08-30T17:43:31Z,"[""2025-08-30T17:43:31Z"",""2025-08-30T17:44:01Z"")",e42664af-2e03-4148-82b4-e0a00172fdfd
2025-08-30T17:52:16Z,order,,0,1,0,0,0,gdrive/dq_cary/DT_File20250830170001000.mp4,0,"{""1"":""Operator: Welcome to Dairy Queen, how may I help you?\nCustomer: Yeah, one second please, thanks.\nCustomer: Let me get two of the two for five dollar two piece chicken strips.\nOperator: You want eight chicken strips?\nCustomer: Yeah, please. That'll be ten, right?\nOperator: Yes. What was the dipping sauce?\nCustomer: How about all honey mustard?\nOperator: Anything else?\nCustomer: Yeah, let me get a chocolate dip medium.\nOperator: Okay.\nCustomer: But white ice cream.\nOperator: Okay.\nCustomer: Okay, that's all.\nOperator: It'll be $15.04.\nCustomer: Okay."",""2"":""1"",""3"":""0"",""4"":""0"",""5"":""0"",""6"":""0"",""7"":""0""}","Operator: Welcome to Dairy Queen, how may I help you?
Customer: Yeah, one second please, thanks.
Customer: Let me get two of the two for five dollar two piece chicken strips.
Operator: You want eight chicken strips?
Customer: Yeah, please. That'll be ten, right?
Operator: Yes. What was the dipping sauce?
Customer: How about all honey mustard?
Operator: Anything else?
Customer: Yeah, let me get a chocolate dip medium.
Operator: Okay.
Customer: But white ice cream.
Operator: Okay.
Customer: Okay, that's all.
Operator: It'll be $15.04.
Customer: Okay.",1,3135.0,3045.0,42a7212b-5c74-4e94-b42c-f2479402b71f,2025-08-30T17:50:46Z,"[""2025-08-30T17:50:46Z"",""2025-08-30T17:52:16Z"")",e42664af-2e03-4148-82b4-e0a00172fdfd
2025-08-30T17:55:31Z,order,,0,1,0,0,0,gdrive/dq_cary/DT_File20250830170001000.mp4,0,"{""1"": ""Operator: Welcome to Dairy Queen, how may I help you?\nCustomer: Hi, can I get a small chocolate chip cookie dough blizzard?\nOperator: Okay. Anything else?\nCustomer: She wants that. One small Oreo blizzard.\nOperator: I'm sorry, can you repeat that for me?\nCustomer: So, a small chocolate chip cookie dough blizzard, one small Oreo blizzard, one Reese's mini blizzard.\nOperator: You said mini?\nCustomer: No, just small.\nOperator: Small peanut butter, alright.\nCustomer: What was that, I'm sorry?\nOperator: No, small peanut butter cup.\nCustomer: Yes.\nOperator: Alright.\nCustomer: Then, what do you want? Strawberry, what strawberry? Milkshake? Then give me a small strawberry milkshake.\nOperator: Okay.\nCustomer: And one medium twist cone.\nOperator: Okay.\nCustomer: Can you give me a chili cheese dog with a medium fry?\nOperator: Okay.\nCustomer: And that'll be it.\nOperator: I definitely appreciate it. Would you like to round up for a note in the pocket? Kids charity.\nCustomer: Oh, no, thank you.\nOperator: 31.53."", ""2"": ""1"", ""3"": ""0"", ""4"": ""0"", ""5"": ""0"", ""6"": ""0""}","Operator: Welcome to Dairy Queen, how may I help you?
Customer: Hi, can I get a small chocolate chip cookie dough blizzard?
Operator: Okay. Anything else?
Customer: She wants that. One small Oreo blizzard.
Operator: I'm sorry, can you repeat that for me?
Customer: So, a small chocolate chip cookie dough blizzard, one small Oreo blizzard, one Reese's mini blizzard.
Operator: You said mini?
Customer: No, just small.
Operator: Small peanut butter, alright.
Customer: What was that, I'm sorry?
Operator: No, small peanut butter cup.
Customer: Yes.
Operator: Alright.
Customer: Then, what do you want? Strawberry, what strawberry? Milkshake? Then give me a small strawberry milkshake.
Operator: Okay.
Customer: And one medium twist cone.
Operator: Okay.
Customer: Can you give me a chili cheese dog with a medium fry?
Operator: Okay.
Customer: And that'll be it.
Operator: I definitely appreciate it. Would you like to round up for a note in the pocket? Kids charity.
Customer: Oh, no, thank you.
Operator: 31.53.",3,3330.0,3255.0,42a7212b-5c74-4e94-b42c-f2479402b71f,2025-08-30T17:54:16Z,"[""2025-08-30T17:54:16Z"",""2025-08-30T17:55:31Z"")",e42664af-2e03-4148-82b4-e0a00172fdfd
2025-08-30T17:56:46Z,order,,0,1,0,0,0,gdrive/dq_cary/DT_File20250830170001000.mp4,1,"{""1"": ""Operator: Thank you for choosing DQ, this is Pat speaking. What can I get for you today?\nCustomer: Could I get a mini pumpkin pie blizzard?\nOperator: Mini pumpkin pie, no problem. What else can I get for you?\nCustomer: But can I get extra, like, pumpkin pie?\nOperator: The pumpkin pie filling, no problem. What else can I get for you?\nCustomer: Could I get a kid's cheeseburger meal?\nOperator: Okay.\nCustomer: With a water.\nOperator: Alright, what's your ice cream with that?\nCustomer: Can I get the... does it come with a fudge sundae?\nOperator: I can give you that.\nCustomer: Okay, can I get the strawberry sundae?\nOperator: You want a fudge or you want strawberry?\nCustomer: Oh, can I get strawberry? Sorry.\nOperator: Okay.\nCustomer: That'll be it.\nOperator: I definitely appreciate it, ma'am. You're looking at a total of... 11.44. Have a great day.\nCustomer: Okay, thanks."", ""2"": ""1"", ""3"": ""0"", ""4"": ""0"", ""5"": ""0"", ""6"": ""0""}","Operator: Thank you for choosing DQ, this is Pat speaking. What can I get for you today?
Customer: Could I get a mini pumpkin pie blizzard?
Operator: Mini pumpkin pie, no problem. What else can I get for you?
Customer: But can I get extra, like, pumpkin pie?
Operator: The pumpkin pie filling, no problem. What else can I get for you?
Customer: Could I get a kid's cheeseburger meal?
Operator: Okay.
Customer: With a water.
Operator: Alright, what's your ice cream with that?
Customer: Can I get the... does it come with a fudge sundae?
Operator: I can give you that.
Customer: Okay, can I get the strawberry sundae?
Operator: You want a fudge or you want strawberry?
Customer: Oh, can I get strawberry? Sorry.
Operator: Okay.
Customer: That'll be it.
Operator: I definitely appreciate it, ma'am. You're looking at a total of... 11.44. Have a great day.
Customer: Okay, thanks.",3,3405.0,3330.0,42a7212b-5c74-4e94-b42c-f2479402b71f,2025-08-30T17:55:31Z,"[""2025-08-30T17:55:31Z"",""2025-08-30T17:56:46Z"")",e42664af-2e03-4148-82b4-e0a00172fdfd
2025-08-30T17:58:01Z,order,,0,1,0,0,0,gdrive/dq_cary/DT_File20250830170001000.mp4,2,"{""1"": ""Operator: Thank you for choosing DQ, this is Pat speaking. What can I get for you?\nCustomer: Hey, can I just get a small chocolate chip cookie dough blizzard?\nOperator: Small chocolate chip cookie dough? No problem at all. Can I get you anything else today?\nCustomer: No, thank you.\nOperator: Would you like to round up for a note in the pocket? Kids charity?\nCustomer: Yeah, that's fine.\nOperator: I appreciate it. It's going to be 6 even. Have a great day.\nCustomer: You too."", ""2"": ""1"", ""3"": ""0"", ""4"": ""0"", ""5"": ""0"", ""6"": ""0""}","Operator: Thank you for choosing DQ, this is Pat speaking. What can I get for you?
Customer: Hey, can I just get a small chocolate chip cookie dough blizzard?
Operator: Small chocolate chip cookie dough? No problem at all. Can I get you anything else today?
Customer: No, thank you.
Operator: Would you like to round up for a note in the pocket? Kids charity?
Customer: Yeah, that's fine.
Operator: I appreciate it. It's going to be 6 even. Have a great day.
Customer: You too.",3,3480.0,3405.0,42a7212b-5c74-4e94-b42c-f2479402b71f,2025-08-30T17:56:46Z,"[""2025-08-30T17:56:46Z"",""2025-08-30T17:58:01Z"")",e42664af-2e03-4148-82b4-e0a00172fdfd
